{
  "messageId": "message-id-example",
  "type": "SeasonFinalized",
  "version": "1.0.0",
  "occurredAt": "2026-09-08T12:00:00Z",
  "tenantId": "tenant-id-example",
  "regionId": "region-id-example",
  "clusterId": "cluster-id-example",
  "correlationId": "correlation-id-example",
  "data": {
    "boardId": "board-id-example",
    "seasonId": "season-id-example",
    "revision": "1",
    "snapshotDigest": "aaaaaaaaaaaaaaaaaaaaaaaaaaaaaaaaaaaaaaaaaaaaaaaaaaaaaaaaaaaaaaaa",
    "finalizedAt": "2026-09-08T12:00:00Z"
  },
  "aggregateId": "aggregate-id-example",
  "aggregateRevision": "1",
  "causationId": "causation-id-example"
}
